{
 "year": "2025",
 "rules_version": 4,
 "archive_commit": "a2d1cbc466637b71fbcbcaa6a946d4596a0a0b2e",
 "reviewed_on": "2026-10-30",
 "decisions": [
  {
   "candidate_id": "city-council-2025-01-21--item-9",
   "decision": "reject",
   "reason": "Standing language in every bid-solicitation list: each contract over the City Manager's threshold comes to Council anyway, so there is nothing separate to follow up."
  },
  {
   "candidate_id": "city-council-2025-01-21--item-10",
   "decision": "reject",
   "reason": "Routine report, not a follow-up to a tracked commitment."
  },
  {
   "candidate_id": "city-council-2025-01-21--item-26",
   "decision": "confirm",
   "commitment": {
    "label": "City Manager develop changes to BMC Title 21 (Subdivisions), and with the Planning Commission to Title 23 (Zoning), to expand ownership opportunities for middle housing",
    "actor": "City Manager",
    "kind": "deliverable",
    "quote_field": "recommendation"
   },
   "matter": {
    "id": "middle-income-homeownership-2025",
    "title": "Middle-income homeownership through subdivision and zoning changes",
    "kind": "council_referral",
    "description": "City Council, 2025-01-21, Item 26: Expanding Homeownership Opportunities for Middle-Income Earners. Moved to the Consent Calendar and approved as revised in Supplemental Communications Packet #2."
   }
  },
  {
   "candidate_id": "city-council-2025-01-21--item-29",
   "decision": "reject",
   "reason": "Follow-up report from the City Auditor; the directions it covers are not in the 2025 bundle."
  },
  {
   "candidate_id": "city-council-2025-02-11-0--item-2",
   "decision": "reject",
   "reason": "Standing language in every bid-solicitation list: each contract over the City Manager's threshold comes to Council anyway, so there is nothing separate to follow up."
  },
  {
   "candidate_id": "city-council-2025-02-11-0--item-7",
   "decision": "confirm",
   "commitment": {
    "label": "City Manager prioritize study of intersections with traffic diverters but no stop signs, and update Council on the status and timeline of past referrals to adopt NACTO street design standards",
    "actor": "City Manager",
    "kind": "report_back",
    "quote_field": "recommendation"
   },
   "matter": {
    "id": "traffic-diverter-intersections-nacto-2025",
    "title": "Traffic-diverter intersections and NACTO street design standards",
    "kind": "council_referral",
    "description": "City Council, 2025-02-11, Item 7: Refer to City Manager study of intersections with traffic diverters. Approved as revised in Supplemental Communications Packet #2."
   }
  },
  {
   "candidate_id": "city-council-2025-02-11-0--item-8",
   "decision": "confirm",
   "commitment": {
    "label": "City Manager report back on the status of the 8 re-opened 2009 leases audit recommendations in fall 2025, and every year until fully implemented",
    "actor": "City Manager",
    "kind": "report_back",
    "quote_field": "recommendation"
   },
   "matter": {
    "id": "leases-audit-follow-up-2025",
    "title": "2009 leases audit follow-up (City Auditor, 2025)",
    "kind": "audit",
    "description": "City Council, 2025-02-11, Item 8: 2009 Leases Audit Follow-Up: Berkeley Faces the Same Risks 16 Years Later. The Council approved the City Auditor's recommendation that the City Manager report back on the 8 re-opened recommendations."
   }
  },
  {
   "candidate_id": "city-council-2025-02-11-0--item-9",
   "decision": "confirm",
   "commitment": {
    "label": "City Manager award six points for panel upgrades under the amended BESO; the Council also requested an evaluation report three years after implementation",
    "actor": "City Manager",
    "kind": "deliverable",
    "quote_field": "action"
   },
   "matter": {
    "id": "beso-amendments-2025",
    "title": "Building Emissions Saving Ordinance (BESO) amendments",
    "kind": "council_referral",
    "description": "City Council, 2025-02-11, Item 9: Proposed Amendments to the Building Emissions Saving Ordinance (BESO). The Council adopted the ordinance on first reading, referred the buyer/seller split to the City Attorney, referred panel-upgrade points to the City Manager, and requested an evaluation report three years after implementation."
   }
  },
  {
   "candidate_id": "city-council-2025-02-11-1--item-1b",
   "decision": "confirm",
   "commitment": {
    "label": "City Manager return to Council by the end of 2025 with a resolution adopting building, historical and fire codes for Berkeley Fire Zones 3 and 4",
    "actor": "City Manager",
    "kind": "deliverable",
    "quote_field": "recommendation"
   },
   "matter": {
    "id": "ember-building-code-2025",
    "title": "EMBER: building code amendments for Fire Zones 3 and 4",
    "kind": "council_referral",
    "description": "City Council, 2025-02-11 (special meeting), Item 1b: Effective Mitigations for Berkeley's Ember Resilience (EMBER): Building Code Amendments. Under Item 1a, the Council referred Items 1a, 1b and 1c to the City Manager for outreach and refinement, to be presented for adoption in March 2025 or as noted in each item."
   }
  },
  {
   "candidate_id": "city-council-2025-02-11-1--item-1c",
   "decision": "confirm",
   "commitment": {
    "label": "City Manager return to Council by the second week of May 2025 on the thresholds for Extreme Fire Weather and Particularly Dangerous Situation designations and their effect on the Leave Early concept",
    "actor": "City Manager",
    "kind": "report_back",
    "quote_field": "recommendation"
   },
   "matter": {
    "id": "ember-leave-early-2025",
    "title": "EMBER: Leave Early and extreme fire weather thresholds",
    "kind": "council_referral",
    "description": "City Council, 2025-02-11 (special meeting), Item 1c: Effective Mitigations for Berkeley's Ember Resilience (EMBER): Leave Early and Fire Department Staffing. Under Item 1a, the Council referred Items 1a, 1b and 1c to the City Manager for outreach and refinement, to be presented for adoption in March 2025 or as noted in each item."
   }
  },
  {
   "candidate_id": "city-council-2025-02-11-1--item-1d",
   "decision": "confirm",
   "commitment": {
    "label": "City Manager direct Public Works, Police and Fire to implement Safe Passages Program phases 1 and 2, and report back on progress by the second week of May 2025",
    "actor": "City Manager",
    "kind": "report_back",
    "quote_field": "recommendation"
   },
   "matter": {
    "id": "ember-safe-passages-2025",
    "title": "EMBER: Safe Passages Program",
    "kind": "council_referral",
    "description": "City Council, 2025-02-11 (special meeting), Item 1d: Request Inter-Departmental Collaboration and Implementation of Safe Passages. Under Item 1a, the Council referred Item 1d to the City Manager as written."
   }
  },
  {
   "candidate_id": "city-council-2025-02-25-0--item-1",
   "decision": "reject",
   "reason": "Routine report, not a follow-up to a tracked commitment."
  },
  {
   "candidate_id": "city-council-2025-03-11--item-6",
   "decision": "reject",
   "reason": "Standing language in every bid-solicitation list: each contract over the City Manager's threshold comes to Council anyway, so there is nothing separate to follow up."
  },
  {
   "candidate_id": "city-council-2025-03-11--item-14",
   "decision": "confirm",
   "commitment": {
    "label": "City Manager study the fiscal impact and feasibility of a transfer tax exemption for 100% affordable housing owned by non-profits or community land trusts, and recommend further Council action",
    "actor": "City Manager",
    "kind": "deliverable",
    "quote_field": "recommendation"
   },
   "matter": {
    "id": "affordable-housing-transfer-tax-exemption-2025",
    "title": "Transfer tax exemption for 100% affordable housing",
    "kind": "council_referral",
    "description": "City Council, 2025-03-11, Item 14: A Referral to the City Manager to make a recommendation for further Council action: Transfer Tax Exemption for 100% Affordable Housing Projects. Approved as recommended by the Land Use, Housing & Economic Development Policy Committee."
   }
  },
  {
   "candidate_id": "city-council-2025-03-11--item-16",
   "decision": "reject",
   "reason": "The Council adopted the policy committee's recommendation to take no action."
  },
  {
   "candidate_id": "city-council-2025-03-11-0--item-1",
   "decision": "confirm",
   "commitment": {
    "label": "City Manager run the 2025 referral ranking algorithm and return to Council with a final ranked list for adoption",
    "actor": "City Manager",
    "kind": "deliverable",
    "quote_field": "action"
   },
   "matter_id": "referral-prioritization-rrv-2024"
  },
  {
   "candidate_id": "city-council-2025-03-18--item-10",
   "decision": "reject",
   "reason": "The Council referred the item back to the Commission on the Status of Women, not to the City Manager.",
   "links": [
    {
     "to": "city-council-2025-12-02-0--item-1",
     "decision": "reject",
     "reason": "The Vision 2050 Task Force report shares only title words with this item; it is not a follow-up."
    }
   ]
  },
  {
   "candidate_id": "city-council-2025-03-18-0--item-1",
   "decision": "reject",
   "reason": "Routine report, not a follow-up to a tracked commitment."
  },
  {
   "candidate_id": "city-council-2025-03-25--item-4",
   "decision": "reject",
   "reason": "Standing language in every bid-solicitation list: each contract over the City Manager's threshold comes to Council anyway, so there is nothing separate to follow up."
  },
  {
   "candidate_id": "city-council-2025-03-25--item-10a",
   "decision": "reject",
   "reason": "The Council adopted the companion report (Item 10b) by resolution; the Item 10a directions quoted here were not adopted."
  },
  {
   "candidate_id": "city-council-2025-03-25--item-11",
   "decision": "reject",
   "reason": "Routine report, not a follow-up to a tracked commitment."
  },
  {